URL,Version,Status,OIDs,Name,Title,Description,Used
http://hl7.org/fhir/CodeSystem/measure-aggregate-method,5.0.0,active,"2.16.840.1.113883.4.642.4.2044",MeasureAggregateMethod,Measure Aggregate Method,"Aggregation method for a measure (e.g. sum, average, median, minimum, maximum, count)","ValueSet/measure-aggregate-method"
http://hl7.org/fhir/CodeSystem/medication-statement-adherence,5.0.0,active,"2.16.840.1.113883.4.642.4.1981",MedicationStatementAdherenceCodes,MedicationStatement Adherence Codes,"MedicationStatement Adherence Codes","ValueSet/medication-statement-adherence"
http://hl7.org/fhir/CodeSystem/medication-statement-status,5.0.0,active,"2.16.840.1.113883.4.642.4.1980",MedicationStatementStatusCodes,MedicationStatement Status Codes,"MedicationStatement Status Codes","ValueSet/medication-statement-status"
http://hl7.org/fhir/CodeSystem/submit-data-update-type,5.0.0,active,"2.16.840.1.113883.4.642.4.1948",SubmitDataUpdateType,Submit Data Update Type,"Concepts for how a measure report consumer and receiver coordinate data exchange updates. The choices are snapshot or incremental updates","ValueSet/submit-data-update-type"
http://hl7.org/fhir/address-type,5.0.0,active,"2.16.840.1.113883.4.642.1.70",AddressType,AddressType,"The type of an address (physical / postal).","ValueSet/address-type"
http://hl7.org/fhir/address-use,5.0.0,active,"2.16.840.1.113883.4.642.1.68",AddressUse,AddressUse,"The use of an address.","ValueSet/address-use"
http://hl7.org/fhir/administrative-gender,5.0.0,active,"2.16.840.1.113883.4.642.4.2",AdministrativeGender,AdministrativeGender,"The gender of a person used for administrative purposes.","ValueSet/administrative-gender"
http://hl7.org/fhir/contact-point-system,5.0.0,active,"2.16.840.1.113883.4.642.1.72",ContactPointSystem,ContactPointSystem,"Telecommunications form for contact point.","ValueSet/contact-point-system"
http://hl7.org/fhir/contact-point-use,5.0.0,active,"2.16.840.1.113883.4.642.1.74",ContactPointUse,ContactPointUse,"Use of contact point.","ValueSet/contact-point-use"
http://hl7.org/fhir/encounter-diagnosis-use,5.0.0,active,"2.16.840.1.113883.4.642.4.2115",EncounterDiagnosisUse,Encounter Diagnosis Use,"Encounter Condition Use","ValueSet/encounter-diagnosis-use"
http://hl7.org/fhir/encounter-location-status,5.0.0,active,"2.16.840.1.113883.4.642.1.258,2.16.840.1.113883.4.642.2.147,2.16.840.1.113883.4.642.4.263",EncounterLocationStatus,Encounter Location Status,"The status of the location.","ValueSet/encounter-location-status"
http://hl7.org/fhir/encounter-reason-use,5.0.0,active,"2.16.840.1.113883.4.642.4.2114",EncounterReasonUse,Encounter Reason Use,"Encounter Reason Use","ValueSet/encounter-reason-use"
http://hl7.org/fhir/encounter-status,5.0.0,active,"2.16.840.1.113883.4.642.4.247,2.16.840.1.113883.4.642.1.242",EncounterStatus,Encounter Status,"Current state of the encounter.","ValueSet/encounter-status"
http://hl7.org/fhir/event-status,5.0.0,draft,"2.16.840.1.113883.4.642.4.110",EventStatus,EventStatus,"Codes identifying the lifecycle stage of an event.","ValueSet/immunization-status"
http://hl7.org/fhir/fhir-types,5.0.0,active,"2.16.840.1.113883.4.642.4.1802",FHIRTypes,All FHIR Types,"One of the types defined as part of this version of FHIR.","ValueSet/fhir-types,ValueSet/participant-resource-types"
http://hl7.org/fhir/identifier-use,5.0.0,active,"2.16.840.1.113883.4.642.1.58",IdentifierUse,IdentifierUse,"Identifies the purpose for this identifier, if known .","ValueSet/identifier-use"
http://hl7.org/fhir/link-type,5.0.0,active,"2.16.840.1.113883.4.642.1.413,2.16.840.1.113883.4.642.2.234,2.16.840.1.113883.4.642.4.424",LinkType,Link Type,"The type of link between this Patient resource and other Patient/RelatedPerson resource(s).","ValueSet/link-type"
http://hl7.org/fhir/measure-definition-example,5.0.0,active,"2.16.840.1.113883.4.642.4.2043",MeasureDefinitionExample,Measure Definition Example,"Example Measure Definitions for the Measure Resource.","ValueSet/measure-definition-example"
http://hl7.org/fhir/measure-group-example,5.0.0,active,"2.16.840.1.113883.4.642.4.2045",MeasureGroupExample,Measure Group Example,"Example Measure Groups for the Measure Resource.","ValueSet/measure-group-example"
http://hl7.org/fhir/measure-report-status,5.0.0,active,"2.16.840.1.113883.4.642.4.777,2.16.840.1.113883.4.642.1.760",MeasureReportStatus,Measure Report Status,"The status of the measure report.","ValueSet/measure-report-status"
http://hl7.org/fhir/measure-report-type,5.0.0,active,"2.16.840.1.113883.4.642.1.762,2.16.840.1.113883.4.642.4.779",MeasureReportType,Measure Report Type,"The type of the measure report.","ValueSet/measure-report-type"
http://hl7.org/fhir/measure-stratifier-example,5.0.0,active,"2.16.840.1.113883.4.642.4.2047",MeasureStratifierExample,Measure Stratifier Example,"Identifier subgroups in a population for measuring purposes.","ValueSet/measure-stratifier-example"
http://hl7.org/fhir/measure-supplemental-data-example,5.0.0,active,"2.16.840.1.113883.4.642.4.2046",MeasureSupplementalDataExample,Measure Supplemental Data Example,"Identifier supplemental data in a population for measuring purposes.","ValueSet/measure-supplemental-data-example"
http://hl7.org/fhir/measurereport-stratifier-value-example,5.0.0,active,"2.16.840.1.113883.4.642.4.1947",MeasureReportStratifierValueExample,Measure Report Stratifier Value Example,"Example Region Value Measure Groups for the Measure Resource.","ValueSet/measurereport-stratifier-value-example"
http://hl7.org/fhir/name-use,5.0.0,active,"2.16.840.1.113883.4.642.4.66",NameUse,NameUse,"The use of a human name.","ValueSet/name-use"
http://hl7.org/fhir/observation-referencerange-normalvalue,5.0.0,active,"2.16.840.1.113883.4.642.4.2099",ObservationReferenceRangeNormalValue,ObservationreferenceRangeNormalValue,"Codes that describe the normal value in the reference range.","ValueSet/observation-referencerange-normalvalue"
http://hl7.org/fhir/observation-triggeredbytype,5.0.0,active,"2.16.840.1.113883.4.642.4.2098",TriggeredBytype,triggered Bytype,"Codes providing the triggeredBy type of observation.","ValueSet/observation-triggeredbytype"
http://hl7.org/fhir/publication-status,5.0.0,active,"2.16.840.1.113883.4.642.4.4",PublicationStatus,PublicationStatus,"The lifecycle status of an artifact.","ValueSet/publication-status"
http://hl7.org/fhir/version-algorithm,5.0.0,active,"2.16.840.1.113883.4.642.4.1989",VersionAlgorithm,Version Algorithm,"Indicates the mechanism used to compare versions to determine which is more current.","ValueSet/version-algorithm"
http://loinc.org,3.1.0,active,"2.16.840.1.113883.6.1",LOINC,Logical Observation Identifiers, Names and Codes (LOINC),"LOINC provides a set of universal names and ID codes for identifying laboratory and clinical test results.1,2 LOINC facilitates the exchange and pooling of results, such as blood hemoglobin, serum potassium, or vital signs, for clinical care, outcomes management, and research. LOINC's universal identifiers (names and codes) can be used in the context of order and observation exchanges between information systems that use syntax standards such as HL73, CEN TC251, ISO TC215, ASTM4, and DICOM. Specifically, the identifier can be used as the coded value for an observation in any other standard that uses the observation/observation value paradigm, whether messages, documents, application programming interface (API), etc. For example, LOINC codes are used widely in the OBX segment Observation Identifier field (OBX-3) of an ORU HL7 (HL7 version 2.x or ASTM 1238-9410) message that may be sent between a Clinical Laboratory Information Management Systems (LIMS) and Electronic Health Record Systems (EHR).5, 6 In this way, LOINC codes provide universal identifiers that allow the exchange of clinical data between heterogeneous computing environments.","ValueSet/immunization-vaccine-funding-program,ValueSet/observation-codes"
http://terminology.hl7.org/CodeSystem/admit-source,1.0.1,active,"2.16.840.1.113883.4.642.1.1092",AdmitSource,Admit source,"This value set defines a set of codes that can be used to indicate from where the patient came in.","ValueSet/encounter-admit-source"
http://terminology.hl7.org/CodeSystem/composite-measure-scoring,1.0.1,active,"2.16.840.1.113883.4.642.1.1235",CompositeMeasureScoring,CompositeMeasureScoring,"The composite scoring method of the measure.","ValueSet/composite-measure-scoring"
http://terminology.hl7.org/CodeSystem/condition-category,1.0.1,active,"2.16.840.1.113883.4.642.1.1073",ConditionCategoryCodes,Condition Category Codes,"Preferred value set for Condition Categories.","ValueSet/condition-category"
http://terminology.hl7.org/CodeSystem/condition-clinical,3.0.0,active,"2.16.840.1.113883.4.642.1.1074",ConditionClinicalStatusCodes,Condition Clinical Status Codes,"Preferred value set for Condition Clinical Status.","ValueSet/condition-clinical"
http://terminology.hl7.org/CodeSystem/condition-ver-status,2.0.1,active,"2.16.840.1.113883.4.642.1.1075",ConditionVerificationStatus,ConditionVerificationStatus,"The verification status to support or decline the clinical status of the condition or diagnosis.","ValueSet/condition-ver-status"
http://terminology.hl7.org/CodeSystem/data-absent-reason,1.0.0,active,"2.16.840.1.113883.4.642.4.1048",DataAbsentReason,DataAbsentReason,"Used to specify why the normally expected content of the data element is missing.","ValueSet/data-absent-reason"
http://terminology.hl7.org/CodeSystem/definition-topic,1.0.1,active,"2.16.840.1.113883.4.642.1.1244",DefinitionTopic,DefinitionTopic,"High-level categorization of the definition, used for searching, sorting, and filtering.","ValueSet/definition-topic"
http://terminology.hl7.org/CodeSystem/diet,1.0.1,active,"2.16.840.1.113883.4.642.1.1091",Diet,Diet,"This value set defines a set of codes that can be used to indicate dietary preferences or restrictions a patient may have.","ValueSet/encounter-diet"
http://terminology.hl7.org/CodeSystem/discharge-disposition,1.0.1,active,"2.16.840.1.113883.4.642.1.1093",DischargeDisposition,Discharge disposition,"This value set defines a set of codes that can be used to where the patient left the hospital.","ValueSet/encounter-discharge-disposition"
http://terminology.hl7.org/CodeSystem/encounter-special-arrangements,1.0.1,active,"2.16.840.1.113883.4.642.1.1090",SpecialArrangements,Special arrangements,"This value set defines a set of codes that can be used to indicate the kinds of special arrangements in place for a patients visit.","ValueSet/encounter-special-arrangements"
http://terminology.hl7.org/CodeSystem/encounter-subject-status,2.0.1,active,"2.16.840.1.113883.4.642.1.1420",EncounterSubjectStatus,Encounter subject status,"This example value set defines a set of codes that can be used to indicate the status of the subject within the encounter","ValueSet/encounter-subject-status"
http://terminology.hl7.org/CodeSystem/encounter-type,1.0.1,active,"2.16.840.1.113883.4.642.1.1088",EncounterType,Encounter type,"This example value set defines a set of codes that can be used to indicate the type of encounter: a specific code indicating type of service provided.","ValueSet/encounter-type"
http://terminology.hl7.org/CodeSystem/extra-security-role-type,1.0.1,active,,SecurityRoleType,Security Role Type,"This CodeSystem contains Additional FHIR-defined Security Role types not defined elsewhere","ValueSet/participation-role-type"
http://terminology.hl7.org/CodeSystem/immunization-funding-source,1.0.1,active,"2.16.840.1.113883.4.642.1.1100",ImmunizationFundingSource,Immunization Funding Source,"The value set to instantiate this attribute should be drawn from a terminologically robust code system that consists of or contains concepts to support describing the source of the vaccine administered. This value set is provided as a suggestive example.","ValueSet/immunization-funding-source"
http://terminology.hl7.org/CodeSystem/immunization-origin,1.0.1,active,"2.16.840.1.113883.4.642.1.1101",ImmunizationOriginCodes,Immunization Origin Codes,"The value set to instantiate this attribute should be drawn from a terminologically robust code system that consists of or contains concepts to support describing the source of the data when the report of the immunization event is not based on information from the person, entity or organization who administered the vaccine. This value set is provided as a suggestive example.","ValueSet/immunization-origin"
http://terminology.hl7.org/CodeSystem/immunization-program-eligibility,1.0.1,active,"2.16.840.1.113883.4.642.1.1099",ImmunizationProgramEligibility,Immunization Program Eligibility,"The value set to instantiate this attribute should be drawn from a terminologically robust code system that consists of or contains concepts to support describing the patient's eligibility for a vaccination program. This value set is provided as a suggestive example.","ValueSet/immunization-program-eligibility"
http://terminology.hl7.org/CodeSystem/immunization-subpotent-reason,1.0.1,active,"2.16.840.1.113883.4.642.1.1098",ImmunizationSubpotentReason,Immunization Subpotent Reason,"The value set to instantiate this attribute should be drawn from a terminologically robust code system that consists of or contains concepts to support describing the reason why a dose is considered to be subpotent. This value set is provided as a suggestive example.","ValueSet/immunization-subpotent-reason"
http://terminology.hl7.org/CodeSystem/location-physical-type,2.0.1,active,"2.16.840.1.113883.4.642.1.1108",LocationType,Location type,"This example value set defines a set of codes that can be used to indicate the physical form of the Location.  This includes several 'non physical' codes which are still considered a location.","ValueSet/location-form"
http://terminology.hl7.org/CodeSystem/measure-data-usage,1.0.1,active,"2.16.840.1.113883.4.642.1.1234",MeasureDataUsage,MeasureDataUsage,"The intended usage for supplemental data elements in the measure.","ValueSet/measure-data-usage"
http://terminology.hl7.org/CodeSystem/measure-improvement-notation,1.0.1,active,"2.16.840.1.113883.4.642.1.1395",MeasureImprovementNotation,MeasureImprovementNotation,"Observation values that indicate what change in a measurement value or score is indicative of an improvement in the measured item or scored issue.","ValueSet/measure-improvement-notation"
http://terminology.hl7.org/CodeSystem/measure-population,2.0.0,active,"2.16.840.1.113883.4.642.1.1231",MeasurePopulationType,Measure Population Type,"The type of population.","ValueSet/measure-population"
http://terminology.hl7.org/CodeSystem/measure-scoring,4.0.0,active,"2.16.840.1.113883.4.642.1.1232",MeasureScoring,Measure Scoring,"The scoring type of the measure.","ValueSet/measure-scoring"
http://terminology.hl7.org/CodeSystem/measure-type,3.0.1,active,"2.16.840.1.113883.4.642.1.1233",MeasureType,MeasureType,"The type of measure (includes codes from 2.16.840.1.113883.1.11.20368).","ValueSet/measure-type"
http://terminology.hl7.org/CodeSystem/medicationrequest-admin-location,1.0.1,active,"2.16.840.1.113883.4.642.1.0",MedicationRequest_Administration_Location_Codes,Medication request  administration  location  codes,"MedicationRequest Administration Location Codes","ValueSet/medicationrequest-admin-location"
http://terminology.hl7.org/CodeSystem/observation-category,1.0.1,active,"2.16.840.1.113883.4.642.1.1125",ObservationCategoryCodes,Observation Category Codes,"Observation Category codes.","ValueSet/observation-category"
http://terminology.hl7.org/CodeSystem/organization-type,2.0.1,active,"2.16.840.1.113883.4.642.1.1128",OrganizationType,Organization type,"This example value set defines a set of codes that can be used to indicate a type of organization.","ValueSet/organization-type"
http://terminology.hl7.org/CodeSystem/participant-type,1.0.1,active,"2.16.840.1.113883.4.642.1.1089",ParticipantType,Participant type,"This value set defines a set of codes that can be used to indicate how an individual participates in an encounter.","ValueSet/encounter-participant-type"
http://terminology.hl7.org/CodeSystem/referencerange-meaning,1.0.1,active,"2.16.840.1.113883.4.642.1.1124",ObservationReferenceRangeMeaningCodes,Observation Reference Range Meaning Codes,"This value set defines a set of codes that can be used to indicate the meaning/use of a reference range for a particular target population.","ValueSet/referencerange-meaning"
http://terminology.hl7.org/CodeSystem/v2-0092,2.0.0,active,"2.16.840.1.113883.18.36",ReAdmissionIndicator,re-admissionIndicator,"Code system of concepts which are used to specify that a patient is being re admitted to a healthcare facilityin from which they were discharged, and indicates the circumstances around such re-admission.  Used in HL7 Version 2.x messagine in the PV1 segment.","ValueSet/v2-0092"
http://terminology.hl7.org/CodeSystem/v2-0131,2.0.0,active,"2.16.840.1.113883.18.58",ContactRole2,contactRole2,"Code system of concepts which specify a relationship role that the next of kin/associated parties plays with regard to the patient. Also used in referrals, for example, it may be necessary to identify the contact representative at the clinic that sent a referral. Used in HL7 Version 2 messaging in the NK1 and CTD segments after 2.5, when it replace 2.16.840.1.113883.18.57.","ValueSet/patient-contactrelationship"
http://terminology.hl7.org/CodeSystem/v2-0203,5.0.0,active,"2.16.840.1.113883.18.108",IdentifierType,identifierType,"HL7-defined code system of concepts specifying type of identifier. Used in HL7 Version 2.x messaging data types CX, PLN, PPN, XCN and XON.","ValueSet/identifier-type"
http://terminology.hl7.org/CodeSystem/v2-0443,2.0.0,active,"2.16.840.1.113883.18.283",ProviderRole,providerRole,"Code system of concepts specifying the functional involvement with the activity being transmitted (e.g., Case Manager, Evaluator, Transcriber, Nurse Care Practitioner, Midwife, Physician Assistant, etc.).  Used in HL7 Version 2.x messaging in the ROL segment.","ValueSet/immunization-function"
http://terminology.hl7.org/CodeSystem/v2-0532,2.0.0,active,"2.16.840.1.113883.18.347",ExpandedYesNoIndicator,expandedYes-NoIndicator,"HL7-defined code system of concepts used to specify an expansion on the original Yes/No indicator table by including ""flavors of null"".  It is intended to be applied to fields where the response is not limited to ""yes"" or ""no"".  Used in numerous locations in HL7 Version 2.x messaging.","ValueSet/option-set-yes-no"
http://terminology.hl7.org/CodeSystem/v3-ActCode,9.0.0,active,"2.16.840.1.113883.5.4",ActCode,ActCode,"A code specifying the particular kind of Act that the Act-instance represents within its class.    *Constraints:* The kind of Act (e.g. physical examination, serum potassium, inpatient encounter, charge financial transaction, etc.) is specified with a code from one of several, typically external, coding systems. The coding system will depend on the class of Act, such as LOINC for observations, etc.    Conceptually, the Act.code must be a specialization of the Act.classCode. This is why the structure of ActClass domain should be reflected in the superstructure of the ActCode domain and then individual codes or externally referenced vocabularies subordinated under these domains that reflect the ActClass structure.    Act.classCode and Act.code are not modifiers of each other but the Act.code concept should really imply the Act.classCode concept. For a negative example, it is not appropriate to use an Act.code ""potassium"" together with and Act.classCode for ""laboratory observation"" to somehow mean ""potassium laboratory observation"" and then use the same Act.code for ""potassium"" together with Act.classCode for ""medication"" to mean ""substitution of potassium"". This mutually modifying use of Act.code and Act.classCode is not permitted.","ValueSet/encounter-class"
http://terminology.hl7.org/CodeSystem/v3-ActPriority,3.0.0,active,"2.16.840.1.113883.5.7",ActPriority,ActPriority,"A set of codes (e.g., for routine, emergency), specifying the urgency under which the Act happened, can happen, is happening, is intended to happen, or is requested/demanded to happen.","ValueSet/v3-ActPriority"
http://terminology.hl7.org/CodeSystem/v3-ActReason,3.1.0,active,"2.16.840.1.113883.5.8",ActReason,ActReason,"A set of codes specifying the motivation, cause, or rationale of an Act, when such rationale is not reasonably represented as an ActRelationship of type ""has reason"" linking to another Act.    *Examples:* Example reasons that might qualify for being coded in this field might be: ""routine requirement"", ""infectious disease reporting requirement"", ""on patient request"", ""required by law"".","ValueSet/immunization-status-reason"
http://terminology.hl7.org/CodeSystem/v3-ActSite,3.0.0,active,"2.16.840.1.113883.5.1052",ActSite,ActSite,"An anatomical location on an organism which can be the focus of an act.","ValueSet/immunization-site"
http://terminology.hl7.org/CodeSystem/v3-EncounterSpecialCourtesy,3.0.0,active,"2.16.840.1.113883.5.40",EncounterSpecialCourtesy,EncounterSpecialCourtesy,"**** MISSING DESCRIPTION ****","ValueSet/encounter-special-courtesy"
http://terminology.hl7.org/CodeSystem/v3-MaritalStatus,3.0.0,active,"2.16.840.1.113883.5.2",MaritalStatus,MaritalStatus,"\* \* \* No description supplied \* \* \*    *Open Issue:* The specific meanings of these codes can vary somewhat by jurisdiction and implementation so caution should be used when determining equivalency.    *Open Issue:* fixing and completion of the hierarchy and proper good definitions of all the concepts is badly needed.","ValueSet/marital-status"
http://terminology.hl7.org/CodeSystem/v3-NullFlavor,3.0.0,active,"2.16.840.1.113883.5.1008",NullFlavor,NullFlavor,"A collection of codes specifying why a valid value is not present.","ValueSet/marital-status,ValueSet/encounter-special-courtesy"
http://terminology.hl7.org/CodeSystem/v3-ObservationInterpretation,3.0.0,active,"2.16.840.1.113883.5.83",ObservationInterpretation,ObservationInterpretation,"One or more codes providing a rough qualitative interpretation of the observation, such as ""normal"" / ""abnormal"", ""low"" / ""high"", ""better"" / ""worse"", ""resistant"" / ""susceptible"", ""expected"" / ""not expected"". The value set is intended to be for ANY use where coded representation of an interpretation is needed.","ValueSet/observation-interpretation"
http://terminology.hl7.org/CodeSystem/v3-ParticipationType,5.0.0,active,"2.16.840.1.113883.5.90",ParticipationType,ParticipationType,"A code specifying the meaning and purpose of every Participation instance. Each of its values implies specific constraints on the Roles undertaking the participation.","ValueSet/encounter-participant-type"
http://terminology.hl7.org/CodeSystem/v3-RouteOfAdministration,3.0.0,active,"2.16.840.1.113883.5.112",RouteOfAdministration,RouteOfAdministration,"The path the administered medication takes to get into the body or into contact with the body.","ValueSet/immunization-route"
http://unitsofmeasure.org,3.0.1,active,"2.16.840.1.113883.6.8",UCUM,Unified Code for Units of Measure (UCUM),"The Unified Code for Units of Measure (UCUM) is a code system intended to include all units of measures being contemporarily used in international science, engineering, and business. The purpose is to facilitate unambiguous electronic communication of quantities together with their units. The focus is on electronic communication, as opposed to communication between humans. A typical application of The Unified Code for Units of Measure are electronic data interchange (EDI) protocols, but there is nothing that prevents it from being used in other types of machine communication.","ValueSet/measure-scoring-unit"
https://fhir.hmis.gov.np/CodeSystem/ethnic-code,0.0.1-ballot,active,,EthnicCodeCS,Ethnic Code,"जाति कोडहरू: दलित, जनजाती, मधेसी, मुस्लिम, ब्राह्मण/क्षेत्री, अन्य","ValueSet/ethnic-code"
https://fhir.hmis.gov.np/CodeSystem/free-cost,0.0.1-ballot,active,,FreeCostCS,निशुल्क/शुल्क रू,"निशुल्क/शुल्क रू","ValueSet/free-cost"
https://fhir.hmis.gov.np/CodeSystem/free-service-eligibility,0.0.1-ballot,active,,FreeServiceEligibilityCS,Free Service Eligibility,"Categories of individuals eligible for free health services (निशुल्क सेवा कोड)","ValueSet/free-service-eligibility"
https://fhir.hmis.gov.np/CodeSystem/locations,0.0.1-ballot,active,,LocationsCS,Nepal Administrative Location Codes,"Comprehensive code system for Nepals provinces, districts, and municipalities.","ValueSet/localbody,ValueSet/district,ValueSet/province"
