URL,Version,Status,OIDs,Name,Title,Description,Used
https://fhir.hmis.gov.np/CodeSystem/period-range,0.0.1-ballot,active,,PeriodRangeCS,Period Range,"HMIS period ranges codes based on IHE ADX Range Coding System.  Reference: IHE QRPH Supplement ADX, CP-QRPH-238, https://www.ihe.net/uploadedFiles/Documents/QRPH/IHE_QRPH_Suppl_ADX.pdf#page=78  Durations define the amount if an intervening time between two time points. These durations are represented in the form P[n]Y[n]M[n]DT[n]H[n]M[n]S or P[n]W. The [n] is replaced by the value for each of the time elements that follow the [n] and the letters have the meaning:  P is the duration designator (for period) placed at the start of the duration representation. Y is the year designator that follows the value for the number of years. M is the month designator that follows the value for the number of months. W is the week designator that follows the value for the number of weeks. D is the day designator that follows the value for the number of days. T is the time designator that precedes the time components of the representation. H is the hour designator that follows the value for the number of hours. M is the minute designator that follows the value for the number of minutes. S is the second designator that follows the value for the number of seconds.","ValueSet/age-range"
https://fhir.hmis.gov.np/CodeSystem/service-type,0.0.1-ballot,active,,ServiceTypeCS,सेवाको किसिम कोड सिस्टम,"स्वास्थ्य सेवाका विभिन्न किसिमहरूको कोड सूची","ValueSet/service-type"
https://fhir.hmis.gov.np/CodeSystem/yes-no,0.0.1-ballot,active,,YesNoCS,Yes / No CodeSystem,"For representing Yes and No values in Nepali.","ValueSet/option-set-yes-no"
urn:ietf:bcp:47,2.0.1,active,"2.16.840.1.113883.6.121",Ietf3066,Tags for the Identification of Languages,"Older value from OID registry.  Superceded; see recommendations in BCP-47.","ValueSet/languages,ValueSet/all-languages"
urn:iso:std:iso:3166,1.0.1,active,"1.0.3166.1",ISO3166Part1,ISO 3166-1 Codes for the representation of names of countries and their subdivisions — Part 1: Country code,"ISO 3166-1 establishes codes that represent the current names of countries, dependencies, and other areas of particular geopolitical interest, on the basis of country names obtained from the United Nations.","ValueSet/jurisdiction"
urn:iso:std:iso:3166:-2,2013-11,retired,"1.0.3166.2",Iso3166_2,ISO 3166 Part 2 Country Subdivision Codes,"Identifies the coding system published in the ISO 3166-2 Standard for Country Subdivision codes. This standard is released periodically, and a new OID will be assigned by ISO for new editions.","ValueSet/jurisdiction"
